{
  "$schema": "http://json-schema.org/draft-07/schema#",
  "$id": "https://github.com/mcascone/midi-captain-max/config.schema.json",
  "title": "MIDI Captain Config",
  "description": "Configuration for Paint Audio MIDI Captain MAX custom firmware. This schema is the single source of truth for the config format — TypeScript types are generated from it, Rust structs are validated against it, and Python firmware uses it as reference. Note: the title field drives the generated TypeScript interface name, so keep it short and stable.",
  "type": "object",
  "required": ["buttons"],
  "properties": {
    "device": {
      "type": "string",
      "enum": ["std10", "mini6", "nano4", "duo2", "one1"],
      "default": "std10",
      "description": "Device model. Determines button count and feature availability (encoder/expression are STD10-only)."
    },
    "global_channel": {
      "type": "integer",
      "minimum": 0,
      "maximum": 15,
      "default": 0,
      "description": "Default MIDI channel for all components. Stored as 0-15, displayed as 1-16 in UI."
    },
    "usb_drive_name": {
      "type": "string",
      "maxLength": 11,
      "pattern": "^[A-Z0-9_]+$",
      "default": "MIDICAPTAIN",
      "description": "USB drive volume label. FAT32 compatible: uppercase alphanumeric + underscore, max 11 chars."
    },
    "dev_mode": {
      "type": "boolean",
      "default": false,
      "description": "When true, USB drive mounts on every boot. When false (default), requires holding Switch 1 during boot."
    },
    "buttons": {
      "type": "array",
      "items": { "$ref": "#/definitions/ButtonConfig" },
      "description": "Button configurations. Array length must match device type: std10=10, mini6=6, nano4=4, duo2=2, one1=1."
    },
    "encoder": {
      "$ref": "#/definitions/EncoderConfig",
      "description": "Rotary encoder configuration. Only supported on STD10."
    },
    "expression": {
      "$ref": "#/definitions/ExpressionPedals",
      "description": "Expression pedal configurations. Only supported on STD10."
    },
    "display": {
      "$ref": "#/definitions/DisplayConfig",
      "description": "Display and text rendering settings."
    }
  },
  "additionalProperties": false,
  "definitions": {
    "ButtonColor": {
      "type": "string",
      "enum": ["red", "green", "blue", "yellow", "cyan", "magenta", "orange", "purple", "white"]
    },
    "ButtonMode": {
      "type": "string",
      "enum": ["toggle", "momentary", "flash", "select"]
    },
    "SelectRepress": {
      "type": "string",
      "enum": ["resend", "nothing", "deselect"],
      "default": "resend",
      "description": "Behavior when pressing the already-active member of a select group. 'resend' = re-send on-message, 'nothing' = no MIDI, 'deselect' = self-toggle off (CC only; PC reserved for #47)."
    },
    "OffMode": {
      "type": "string",
      "enum": ["dim", "off"],
      "default": "dim",
      "description": "LED behavior when button is off. 'dim' = reduced brightness, 'off' = extinguished."
    },
    "MessageType": {
      "type": "string",
      "enum": ["cc", "note", "pc", "pc_inc", "pc_dec", "hid", "tempo_tap"],
      "default": "cc"
    },
    "HidAction": {
      "type": "string",
      "enum": ["send", "press", "release", "delay"],
      "default": "send",
      "description": "'send' = press+release, 'press' = hold key, 'release' = release key(s), 'delay' = pause execution."
    },
    "HidModifier": {
      "type": "string",
      "enum": ["ctrl", "shift", "alt", "option", "windows"],
      "description": "Modifier key held during the HID action. 'option' is macOS Alt; 'windows' is the Windows/Meta key."
    },
    "TextSize": {
      "type": "string",
      "enum": ["small", "medium", "large"],
      "default": "medium"
    },
    "Polarity": {
      "type": "string",
      "enum": ["normal", "inverted"],
      "default": "normal",
      "description": "'normal' = forward sweep 0→127, 'inverted' = reverse 127→0."
    },
    "MidiByte": {
      "type": "integer",
      "minimum": 0,
      "maximum": 127,
      "description": "Standard MIDI byte value (0-127)."
    },
    "MidiChannel": {
      "type": "integer",
      "minimum": 0,
      "maximum": 15,
      "description": "MIDI channel. Stored as 0-15, displayed as 1-16 in UI."
    },
    "StateOverride": {
      "type": "object",
      "description": "Per-state overrides applied when cycling through keytimes. All fields optional — only specified fields override the base button config.",
      "properties": {
        "cc":          { "$ref": "#/definitions/MidiByte" },
        "cc_on":       { "$ref": "#/definitions/MidiByte" },
        "cc_off":      { "$ref": "#/definitions/MidiByte" },
        "note":        { "$ref": "#/definitions/MidiByte" },
        "velocity_on": { "$ref": "#/definitions/MidiByte" },
        "velocity_off": { "$ref": "#/definitions/MidiByte" },
        "program":     { "$ref": "#/definitions/MidiByte" },
        "pc_step": {
          "type": "integer",
          "minimum": 1,
          "maximum": 127
        },
        "color":       { "$ref": "#/definitions/ButtonColor" },
        "label": {
          "type": "string",
          "maxLength": 6,
          "pattern": "^[\\w \\-]+$"
        },
        "hid_action":    { "$ref": "#/definitions/HidAction" },
        "hid_key": {
          "type": "string",
          "description": "Key name override for this keytime state."
        },
        "hid_modifier":  { "$ref": "#/definitions/HidModifier" },
        "hid_delay_ms": {
          "type": "integer",
          "minimum": 1,
          "maximum": 5000
        }
      },
      "additionalProperties": false
    },
    "ButtonConfig": {
      "type": "object",
      "required": ["label", "color"],
      "properties": {
        "label": {
          "type": "string",
          "maxLength": 6,
          "pattern": "^[\\w \\-]+$",
          "description": "Display label. Max 6 chars, alphanumeric + space + hyphen."
        },
        "color": {
          "$ref": "#/definitions/ButtonColor",
          "description": "LED color for this button."
        },
        "type": {
          "$ref": "#/definitions/MessageType",
          "description": "MIDI message type. Determines which fields apply. Default: 'cc'."
        },
        "mode": {
          "$ref": "#/definitions/ButtonMode",
          "description": "Button behavior. 'toggle' = latching LED on/off, 'momentary' = LED on while held, 'flash' = brief LED flash on press (PC types only, default for PC types), 'select' = radio-group exclusivity (PC and CC only, requires select_group). Default for CC/Note/HID: 'toggle'."
        },
        "select_group": {
          "type": "string",
          "minLength": 1,
          "description": "Radio-group identifier. Required when mode='select'. Pressing a select-mode button activates it and deactivates all sibling buttons sharing the same select_group. PC and CC types only."
        },
        "select_repress": {
          "$ref": "#/definitions/SelectRepress",
          "description": "Behavior when re-pressing the already-active select-group member. Default: 'resend'."
        },
        "off_mode": {
          "$ref": "#/definitions/OffMode",
          "description": "LED behavior when button is off. Default: 'dim'."
        },
        "channel": {
          "$ref": "#/definitions/MidiChannel",
          "description": "Per-button MIDI channel override. Inherits global_channel if omitted."
        },
        "cc": {
          "$ref": "#/definitions/MidiByte",
          "description": "CC number. Used when type='cc'. Default: 20 + button index."
        },
        "cc_on": {
          "$ref": "#/definitions/MidiByte",
          "description": "CC value sent when button is pressed (ON). Default: 127."
        },
        "cc_off": {
          "$ref": "#/definitions/MidiByte",
          "description": "CC value sent when button is released (OFF). Default: 0."
        },
        "note": {
          "$ref": "#/definitions/MidiByte",
          "description": "MIDI note number. Used when type='note'. Default: 60 (Middle C)."
        },
        "velocity_on": {
          "$ref": "#/definitions/MidiByte",
          "description": "Note velocity when pressed. Used when type='note'. Default: 127."
        },
        "velocity_off": {
          "$ref": "#/definitions/MidiByte",
          "description": "Note velocity when released (Note Off). Used when type='note'. Default: 0."
        },
        "program": {
          "$ref": "#/definitions/MidiByte",
          "description": "Program number. Used when type='pc'. Default: 0."
        },
        "pc_step": {
          "type": "integer",
          "minimum": 1,
          "maximum": 127,
          "default": 1,
          "description": "Step size for program change increment/decrement. Used when type='pc_inc' or 'pc_dec'."
        },
        "flash_ms": {
          "type": "integer",
          "minimum": 50,
          "maximum": 5000,
          "default": 200,
          "description": "LED flash duration in milliseconds. Used when type is PC and mode is 'flash'."
        },
        "keytimes": {
          "type": "integer",
          "minimum": 1,
          "maximum": 99,
          "default": 1,
          "description": "Number of states to cycle through on press. 1 = no cycling."
        },
        "states": {
          "type": "array",
          "items": { "$ref": "#/definitions/StateOverride" },
          "description": "Per-state overrides. Array length should match keytimes value."
        },
        "hid_action": {
          "$ref": "#/definitions/HidAction",
          "description": "HID action to perform. Used when type='hid'. Default: 'send'."
        },
        "hid_key": {
          "type": "string",
          "description": "Key name for HID action. Used when type='hid'. Valid values: A-Z, 0-9, F1-F12, Mouse_L, Mouse_R, Space, Esc, Caps, Right, Left, Up, Down, End, Del, PageUp, PageDown, Enter, Pause, Table, BackSpace, Home, Ins, PrintS, all (for release-all)."
        },
        "hid_modifier": {
          "$ref": "#/definitions/HidModifier",
          "description": "Optional modifier key held during HID action. Used when type='hid' and hid_action='send' or 'press'."
        },
        "hid_delay_ms": {
          "type": "integer",
          "minimum": 1,
          "maximum": 5000,
          "description": "Delay duration in milliseconds. Used when type='hid' and hid_action='delay'."
        },
        "tempo_tap_cc": {
          "$ref": "#/definitions/MidiByte",
          "default": 63,
          "description": "CC number sent for a short tempo tap. Used when type='tempo_tap'."
        },
        "tempo_tap_value": {
          "$ref": "#/definitions/MidiByte",
          "default": 127,
          "description": "CC value sent for a short tempo tap. Used when type='tempo_tap'."
        },
        "tempo_tap_channel": {
          "$ref": "#/definitions/MidiChannel",
          "description": "MIDI channel for short tempo tap output. Inherits button channel if omitted."
        },
        "tempo_tuner_cc": {
          "$ref": "#/definitions/MidiByte",
          "default": 68,
          "description": "CC number sent when long press toggles tuner state. Used when type='tempo_tap'."
        },
        "tempo_tuner_on": {
          "$ref": "#/definitions/MidiByte",
          "default": 127,
          "description": "CC value sent when tuner state toggles on. Used when type='tempo_tap'."
        },
        "tempo_tuner_off": {
          "$ref": "#/definitions/MidiByte",
          "default": 0,
          "description": "CC value sent when tuner state toggles off. Used when type='tempo_tap'."
        },
        "tempo_tuner_channel": {
          "$ref": "#/definitions/MidiChannel",
          "description": "MIDI channel for tuner toggle output. Inherits button channel if omitted."
        },
        "tempo_long_press_ms": {
          "type": "integer",
          "minimum": 100,
          "maximum": 5000,
          "default": 700,
          "description": "Hold duration in milliseconds that triggers the tuner toggle instead of a tap. Used when type='tempo_tap'."
        }
      },
      "additionalProperties": false
    },
    "EncoderPush": {
      "type": "object",
      "required": ["enabled", "cc", "label"],
      "properties": {
        "enabled": {
          "type": "boolean",
          "default": true,
          "description": "Enable/disable encoder push button."
        },
        "cc": {
          "$ref": "#/definitions/MidiByte",
          "default": 14,
          "description": "CC number for push button."
        },
        "label": {
          "type": "string",
          "maxLength": 8,
          "default": "PUSH",
          "description": "Display label. Max 8 chars."
        },
        "mode": {
          "$ref": "#/definitions/ButtonMode",
          "description": "Button behavior. Default: 'momentary'."
        },
        "channel": {
          "$ref": "#/definitions/MidiChannel",
          "description": "Per-push MIDI channel override. Inherits encoder channel or global_channel if omitted."
        },
        "cc_on": {
          "$ref": "#/definitions/MidiByte",
          "description": "CC value when button ON. Default: 127."
        },
        "cc_off": {
          "$ref": "#/definitions/MidiByte",
          "description": "CC value when button OFF. Default: 0."
        }
      },
      "additionalProperties": false
    },
    "EncoderConfig": {
      "type": "object",
      "required": ["enabled", "cc", "label"],
      "properties": {
        "enabled": {
          "type": "boolean",
          "default": true,
          "description": "Enable/disable rotary encoder."
        },
        "cc": {
          "$ref": "#/definitions/MidiByte",
          "default": 11,
          "description": "CC number sent on rotation."
        },
        "label": {
          "type": "string",
          "maxLength": 8,
          "default": "ENC",
          "description": "Display label. Max 8 chars."
        },
        "min": {
          "$ref": "#/definitions/MidiByte",
          "default": 0,
          "description": "Minimum encoder value."
        },
        "max": {
          "$ref": "#/definitions/MidiByte",
          "default": 127,
          "description": "Maximum encoder value. Must be >= min."
        },
        "initial": {
          "$ref": "#/definitions/MidiByte",
          "default": 64,
          "description": "Starting position. Must be between min and max."
        },
        "steps": {
          "type": ["integer", "null"],
          "minimum": 2,
          "default": null,
          "description": "Number of discrete steps. null = continuous rotation."
        },
        "channel": {
          "$ref": "#/definitions/MidiChannel",
          "description": "Per-encoder MIDI channel override. Inherits global_channel if omitted."
        },
        "push": {
          "$ref": "#/definitions/EncoderPush",
          "description": "Encoder push button configuration."
        }
      },
      "additionalProperties": false
    },
    "ExpressionConfig": {
      "type": "object",
      "required": ["enabled", "cc", "label"],
      "properties": {
        "enabled": {
          "type": "boolean",
          "default": true,
          "description": "Enable/disable this expression pedal."
        },
        "cc": {
          "$ref": "#/definitions/MidiByte",
          "description": "CC number sent on pedal movement."
        },
        "label": {
          "type": "string",
          "maxLength": 8,
          "description": "Display label. Max 8 chars."
        },
        "min": {
          "$ref": "#/definitions/MidiByte",
          "default": 0,
          "description": "Minimum output value."
        },
        "max": {
          "$ref": "#/definitions/MidiByte",
          "default": 127,
          "description": "Maximum output value. Must be >= min."
        },
        "polarity": {
          "$ref": "#/definitions/Polarity",
          "description": "Sweep direction. Default: 'normal'."
        },
        "threshold": {
          "$ref": "#/definitions/MidiByte",
          "default": 2,
          "description": "Deadzone threshold. Only report value changes >= this amount."
        },
        "channel": {
          "$ref": "#/definitions/MidiChannel",
          "description": "Per-pedal MIDI channel override. Inherits global_channel if omitted."
        }
      },
      "additionalProperties": false
    },
    "ExpressionPedals": {
      "type": "object",
      "required": ["exp1", "exp2"],
      "properties": {
        "exp1": {
          "$ref": "#/definitions/ExpressionConfig"
        },
        "exp2": {
          "$ref": "#/definitions/ExpressionConfig"
        }
      },
      "additionalProperties": false
    },
    "DisplayConfig": {
      "type": "object",
      "properties": {
        "button_text_size": {
          "$ref": "#/definitions/TextSize",
          "description": "Button label text size."
        },
        "status_text_size": {
          "$ref": "#/definitions/TextSize",
          "description": "Status display text size."
        },
        "expression_text_size": {
          "$ref": "#/definitions/TextSize",
          "description": "Expression pedal text size."
        }
      },
      "additionalProperties": false
    }
  }
}
